<?xml version="1.0" encoding="UTF-8" ?>
<invoice xmlns="http://dae.msoft.edu/ws/invoice"
         xmlns:xsi="http://www.w3.org/2001/XMLSchema-instance"
         xsi:schemaLocation="http://dae.msoft.edu/ws/invoice invoice.xsd">
    <invoiceId>8c7801c6-bc6a-4dca-829b-248722594494</invoiceId>
    <invoiceDate>2024-09-07T06:42:29-05:00</invoiceDate>
    <customerId>1</customerId>
    <invoiceDetails>
        <invoiceDetail>
            <productId>101</productId>
            <productDescription>Ticket-ST</productDescription>
            <productPrice>200.00</productPrice>
            <count>1</count>
        </invoiceDetail>
        <invoiceDetail>
            <productId>102</productId>
            <productDescription>Ticket-PR</productDescription>
            <productPrice>350.00</productPrice>
            <count>2</count>
        </invoiceDetail>
    </invoiceDetails>
    <subtotal>900.00</subtotal>
    <tax15>135.00</tax15>
    <total>1035.00</total>
</invoice>